{
  "id": "saeu-jeot",
  "name": { "en": "Salted Shrimp", "ko": "새우젓" },
  "icon": "🦐",
  "category": { "en": "Pickles & Ferments", "ko": "절임 및 발효 식품" },
  "visual_identity": { "primary_color": "#FADBD8", "texture": "Brined Tiny Shrimp" },
  "difficulty": "hard",
  "dietary_tags": ["keto", "gluten-free"],
  "allergens": ["crustaceans"],
  "swap_warnings": ["염도가 매우 높으므로 소금 대용으로 사용 시 주의가 필요합니다.", "갑각류 알레르기 유발 물질입니다."],
  "measurement_type": "weight",
  "best_use_cases": ["kimchi", "stews", "seasoning-pork"],
  "avoid_use_cases": ["desserts", "sweet-sauces"],
  "properties": {
    "ph_level": 6.0,
    "moisture_content": 60.0,
    "sweetness_index": 10,
    "viscosity": "thick",
    "umami_intensity": 10
  },
  "thermal_behavior": {
    "smoke_point_c": null,
    "melting_point_c": null,
    "caramelization": false,
    "maillard_reaction": true
  },
  "functional_properties": ["umami-booster", "flavor-enhancer", "preservative"],
  "texture_profile": { "state": "solid", "elasticity": "none", "mouthfeel": "grainy" },
  "regional_alias": { "us": ["Korean salted shrimp", "Fermented shrimp"] },
  "regional_availability": { "common_in": ["Korea", "Vietnam", "Thailand"], "rare_in": ["Europe", "US"] },
  "cuisine_origin": ["korean"],
  "preparation_forms": ["paste"],
  "scientific_name": "Acetes japonicus (Mainly)",
  "schema_org_type": "Product",
  "substitutes": [
    {
      "id": "fish-sauce",
      "ratio": { "source": 1, "target_min": 1, "target_max": 1.2, "unit": "tbsp" },
      "substitution_logic": "linear_scaling",
      "failure_risk": "low",
      "flavor_delta": { "salt": 1, "umami": -1 },
      "chemical_impact": {
        "en": "Fish sauce provides salinity and umami but lacks the solid texture and protease enzymes of saeu-jeot.",
        "ko": "액젓은 염도와 감칠맛은 제공하지만, 새우젓 특유의 식감과 단백질 분해 효소(리파아제 등)가 부족합니다."
      },
      "compensation_action": {
        "en": "Add a pinch of salt to match the salinity and use for liquid seasoning only.",
        "ko": "염도를 맞추기 위해 소금을 약간 추가하고, 주로 액체 조미료 용도로만 사용하세요."
      },
      "verification": { "verified_by": "Chef Jinny Park", "date": "2026-04-24", "confidence_score": 92 }
    }
  ]
}
